Título,Seção,Data
Trump se reúne com equipe na Sala de Crise,Principal,17/06/2025
"""Um fim real"" é melhor que cessar-fogo, diz Trump",Principal,17/06/2025
Irã: ministro faz alerta sobre expansão do conflito,Principal,17/06/2025
"Irã atingiu centro do serviço secreto, diz agência",Principal,17/06/2025
Análise: Trump indica que pode dar ultimato ao Irã,Internacional,17/06/2025
Três motivos para acompanhar Ulsan HD x Mamelodi Sundowns,Principal,17/06/2025
Moraes nega pedido de Bolsonaro para anular a delação de Mauro Cid,Principal,17/06/2025
"BPC: aumento reforça necessidade de revisar regras, diz economista",Principal,17/06/2025
"Nissan revela Kicks 2026 com novo visual, mais tecnologia e motor turbo",Principal,17/06/2025
"Eduardo Sterblitch desabafa sobre depressão: ""Muito medo""; veja o relato",Principal,17/06/2025
Árbitro se confunde e exibe imagem de santa ao expulsar jogador no Mundial,Principal,17/06/2025
CNN 360 - Assista à programação ao vivo da CNN Brasil,Principal,17/06/2025
Money News - Assista à programação ao vivo da CNN Money,Principal,17/06/2025
Receita: carbonara de camarão com caldo artesanal,Principal,17/06/2025
"Bolsonaro, Carlos e Ramagem indiciados no caso Abin paralela; entenda",Principal,17/06/2025
Laudo aponta causa da morte de empresário em autódromo em SP,Principal,17/06/2025
Mundial: ultras do Al Ahly roubam bandeirão de palmeirenses,Principal,17/06/2025
Indiciamento vira munição contra candidatura de Carlos Bolsonaro em SC,Politica,17/06/2025
"Plano de golpe expôs papel clandestino da Abin, diz PF",Principal,17/06/2025
Cid: advogado diz que revelou mensagens por estratégia,Principal,17/06/2025
"Há indícios de Zambelli nos arredores de Roma, diz embaixada",Principal,17/06/2025
Flávio Bolsonaro: Processo tem que ser imediatamente anulado,Principal,17/06/2025
Advogado de réu no plano de golpe admite conversa com Cid,Principal,17/06/2025
"Maioria dos brasileiros é contra aumento no número de deputados, aponta Datafolha",Principal,17/06/2025
Al Ahly multa atacante por pênalti perdido no Mundial de Clubes; entenda,Esportes,17/06/2025
PM agride mulher com pauladas e puxões de cabelo em festa junina de Alagoas,Principal,17/06/2025
"Anitta conta que está com infecção bacteriana grave: ""Antibiótico na veia""",Principal,17/06/2025
A origem do QWERTY: por que o teclado que usamos não é alfabético?,Principal,17/06/2025
Apple não permite que vilões usem iPhone em filmes e séries? Entenda,Principal,17/06/2025
"O que é doença de Graves, que acomete atriz de ""The Boys""",Principal,17/06/2025
Embraer assina contrato com Holanda para Sistema de Evacuação Aeromédica,Economia,17/06/2025
Influenciadora que teria viajado com Yamal relata ameaças de morte,Esportes,17/06/2025
"""Boiola depilada"": mulher faz mais ataques homofóbicos após ser solta em SP",Principal,17/06/2025
Deputado Lucas Bove cobra sigilo sobre acusação de agressão de ex-esposa,Politica,17/06/2025
"""Homem com H"" chega ao streaming; saiba onde assistir",Principal,17/06/2025
"Rebel Wilson relata acidente em gravações: ""Tiveram que chamar cirurgião""",Principal,17/06/2025
Eliana recria foto 30 anos depois e faz alerta sobre saúde mental,Principal,17/06/2025
O que acontece com o nosso corpo quando corremos uma maratona?,Principal,17/06/2025
"Yamal: em férias no Brasil, craque do Barcelona, visita a NBA House",Principal,17/06/2025
Corinthians vive incerteza sobre futuro de Garro; entenda,Principal,17/06/2025
Jogador da NBA anuncia nascimento da primeira filha com brasileira,Esportes,17/06/2025
Confira a agenda de hoje da Copa do Mundo de Clubes de 2025,Principal,17/06/2025
Acciona vence lote B de leilão de PPP de esgoto do ES,Economia,17/06/2025
Consórcio GS Inima/Forte Ambiental vence lote A de PPP de esgoto no ES,Economia,17/06/2025
Controladora do GRU Airport fecha acordo e ganha prazo para evitar RJ,Economia,17/06/2025
Fundo Amazônia bate recorde ao destinar mais de R$ 1 bilhão em 2025,Economia,17/06/2025
Aneel recomenda ao MME prorrogação dos contrato de concessão da RGE Sul,Economia,17/06/2025
"Trump se reúne com equipe na Sala de Crise nesta terça (17), diz fonte",Principal,17/06/2025
Julgamento de extradição de foragidos do 8/1 na Argentina é adiado,Principal,17/06/2025
"Trump sobre líder supremo do Irã: ""Nós não vamos matá-lo por enquanto""",Principal,17/06/2025
Rússia chama G7 de inútil e diz que expulsão do G8 foi erro,Principal,17/06/2025
Ataque de Israel mata 59 palestinos que esperavam por comida em Gaza,Internacional,17/06/2025
Ministro iraniano faz alerta sobre possível expansão do conflito com Israel,Internacional,17/06/2025
"Recém-estrelado, omakase em São Paulo oferece imersão no Japão tradicional",Principal,17/06/2025
Confira 5 destinos românticos de inverno perto de São Paulo para curtir a dois,Principal,17/06/2025
"Companhia aérea passa a multar ""passageiros indisciplinados"" em R$ 3,2 mil",Principal,17/06/2025
Viagem de trem de luxo pelos Andes: saiba tudo sobre a expedição,Principal,17/06/2025
"Tesouro no Caribe, Anguilla conquista com sossego e praias desertas",Principal,17/06/2025
10 cidades em São Paulo para conhecer museus e história dos dinossauros,Principal,17/06/2025
"Empresário morto em Autódromo de SP foi vítima de asfixia, aponta laudo  | BASTIDORES CNN",Principal,17/06/2025
"Pesquisa mostra que 33,4 milhões de malas foram extraviadas em 2024  | BASTIDORES CNN",Principal,17/06/2025
Haddad aguarda sugestões do Congresso para ajuste fiscal | BASTIDORES CNN,Politica,17/06/2025
"Análise: Antes da votação do IOF, Hugo Motta se reuniu com ministros para evitar crise | BASTIDORES",Politica,17/06/2025
"Caso Zambelli: “Ninguém é intocável”, diz embaixador em Roma sobre nacionalidade | BASTIDORES CNN",Politica,17/06/2025
"Carla Zambelli pode estar nos arredores de Roma, diz embaixador do Brasil | BASTIDORES CNN",Politica,17/06/2025
Embaixador do Brasil em Roma detalha buscas por Carla Zambelli na Itália | BASTIDORES CNN,Politica,17/06/2025
"Análise: No G7, Lula busca ministros palacianos sobre votação de urgência do IOF | BASTIDORES CNN",Principal,17/06/2025
"Trump sobre líder supremo do Irã: ""Nós não vamos matá-lo"" | BASTIDORES CNN",Internacional,17/06/2025
Brasil teme atuação dos EUA e escalada em conflito no Oriente Médio | BASTIDORES CNN,Internacional,17/06/2025
Israel diz que matou o chefe do Estado-Maior do Irã em ataques noturnos,Principal,17/06/2025
"Empresário morto em Autódromo: ""Tudo indica que ele não chegou ao carro""",Principal,17/06/2025
"PF conclui “Abin Paralela” e indicia Bolsonaro, Ramagem e Carlos",Principal,17/06/2025
"Trump critica Macron e diz que algo ""muito maior"" está em andamento",Principal,17/06/2025
Empresário morto em Autódromo de SP: veja revelações e rumo da investigação,Principal,17/06/2025
Empresário morto em Autódromo em SP: marcas no pescoço podem indicar crime,Principal,17/06/2025
"Em suposto áudio, Cid diz ""que perdeu tudo"" e Bolsonaro ""ganhou milhões""",Principal,17/06/2025
Dia 19 de junho é feriado? Veja datas do segundo semestre de 2025,Principal,17/06/2025
"Não há necessidade de existir o G7, diz Lula ao chegar à cúpula no Canadá",Principal,17/06/2025
"Irã atingiu centro do serviço secreto de Israel, diz agência estatal",Internacional,17/06/2025
Mais de 50% dizem que finanças são a principal briga entre casais,Economia,17/06/2025
"Festas juninas devem movimentar R$ 7,4 bi, com impacto no Nordeste",Economia,17/06/2025
Mais da metade dos brasileiros usa IA para fazer compras,Economia,17/06/2025
Brasil lidera vendas de veículos elétricos na América Latina,Economia,17/06/2025
Fraude no INSS: como saber se vou receber devolução de abril? Tire dúvidas,Economia,17/06/2025
Mercado de trabalho tem disputa entre quiet quitting e quiet hiring,Economia,17/06/2025
Imposto de Renda 2025: entenda as mensagens sobre status da declaração,Economia,17/06/2025
Aviação brasileira teve melhor abril da história; 8 milhões viajaram,Economia,17/06/2025
Veja como ficam as compras internacionais com as novas regras do IOF,Economia,17/06/2025
"SP: Entenda treta sobre serviço de mototáxi entre Justiça, 99 e Uber",Economia,17/06/2025
8 em cada 10 pessoas consideram usar IA para decisões financeiras,Economia,17/06/2025
"China investe no Brasil em delivery, energia e mineração; veja lista",Economia,17/06/2025
MDB é partido com mais prefeitos eleitos na região Norte; veja ranking,Principal,17/06/2025
Power Couple: quais casais já venceram o reality,Principal,17/06/2025
Estêvão diz que Palmeiras pode &#8220;bater de frente&#8221; com qualquer time,Esportes,17/06/2025
Festa Junina: conheça as diferenças das celebrações entre as regiões,Principal,17/06/2025
Entenda por que Israel decidiu atacar o Irã agora,Internacional,17/06/2025
Da prisão à liberdade: entenda investigações contra MC Poze do Rodo,Principal,17/06/2025
Brasil bate recorde de medalhas e tem melhor Paralimpíada da história,Principal,17/06/2025
Zambelli é a sétima brasileira na lista da Interpol,Principal,17/06/2025
"Caminhar mais pode reduzir risco de dor lombar crônica, diz estudo",Saude,17/06/2025
Como identificar vídeos feitos por IA ultrarrealistas? Veja dicas,Tecnologia,17/06/2025
Conheça os Parques Nacionais mais visitados do Brasil,Principal,17/06/2025
"Abin paralela: entenda indiciamento de Bolsonaro, Carlos e Ramagem",Principal,17/06/2025
Datafolha: maioria dos brasileiros é contra aumento no número de deputados,Principal,17/06/2025
"Moraes manda Google informar quem publicou ""minuta do golpe"" na internet",Principal,17/06/2025
COP30: Governo brasileiro e ONU detalham iniciativas éticas sobre mudanças,Principal,17/06/2025
"Trama do golpe, joias e Abin Paralela: os processos de Bolsonaro",Politica,17/06/2025
Nota do Enem dá direito a bolsa para licenciatura,Principal,17/06/2025
Estudando História do Brasil para o Vestibular? Curso on-line podem ajudar,Principal,17/06/2025
Enem 2025: prazo para pagamento da inscrição é ampliado até 27 de junho,Principal,17/06/2025
Enem 2025 registra 10% a mais de inscrições que última edição,Principal,17/06/2025
Universidade na Itália oferece bolsas de doutorado em diversas áreas,Principal,17/06/2025
IA: Instituto Federal do MS oferece curso grátis e on-line sobre o tema,Principal,17/06/2025
"Poluição do ar prejudica desenvolvimento cerebral de bebês, diz estudo",Principal,17/06/2025
"Dose única de medicamento reduz colesterol em até 69%, diz estudo inicial",Principal,17/06/2025
Chocolate amargo e frutas vermelhas podem ajudar a viver mais; saiba como,Saude,17/06/2025
Treinar doente é melhor do que não treinar? Veja,Saude,17/06/2025
Motor turbinado é dor de cabeça? Saiba como preservá-lo,Principal,17/06/2025
"Jaqueta puffer ""inteligente"" usa luz e som para induzir sono",Principal,17/06/2025
"Romero Britto aproveita onda de ""Bobbie Goods"" e lança livro de colorir",Principal,17/06/2025
"Beyoncé faz homenagem a Tina Turner com figurino na ""Cowboy Carter""; veja",Principal,17/06/2025
"No quarto, Benedito Ruy Barbosa deve receber alta nos próximos dias",Principal,17/06/2025
"Diretor de ""F1"" revela por que papel de Simone Ashley foi cortado do filme",Principal,17/06/2025
Pablo e Luisão da vida real vão a aniversário de criança com tema da série,Principal,17/06/2025
"Ney Matogrosso elogia performance de ""Homem com H"" feita por estudante",Principal,17/06/2025
Cineasta realiza funeral de filho de 13 anos e faz “cruzada antibullying”,Principal,17/06/2025
PF faz operação contra quadrilha especializada em crimes contra a Caixa,Principal,17/06/2025
Operação da PF mira comércio ilegal de pescados em 7 estados,Principal,17/06/2025
"Advogados são mandantes da morte de casal de idosos em SP, diz Polícia",Principal,17/06/2025
"Gerente da Caixa desviava recursos de clientes no RS, diz PF",Principal,17/06/2025
"Empresário morto em Autódromo de SP foi vítima de asfixia, aponta laudo",Principal,17/06/2025
"Cannes Lions: ""IA não vai tirar empregos criativos"", diz executivo da Apple",Principal,17/06/2025
"IA aumenta a criação de deepfakes de pornografia com mulheres, diz estudo",Principal,17/06/2025
"Com IAs realistas, futuro da informação depende da capacidade de desconfiar",Principal,17/06/2025
Samsung mira mercado de saúde digital com novos recursos em smartwatches,Tecnologia,17/06/2025
Drones podem monitorar queimadas e emissão de gases de efeito estufa,Tecnologia,17/06/2025
"Conflito entre Israel e Irã tira foco de acordo de paz em Gaza, diz Amorim",Politica,17/06/2025
Relatório para COP30 reúne casos de descarbonização no setor privado,Politica,17/06/2025
Deputado vai ao Oriente Médio para resgatar o pai em Tel Aviv,Politica,17/06/2025
Advogado diz que revelou supostas mensagens de Cid por estratégia de defesa,Politica,17/06/2025
Cardozo: Presidente Lula é viável para as eleições de 2026,Politica,17/06/2025
Análise: Governo poderia cortar gastos de emendas e BPC,Politica,17/06/2025
Análise: Indiciamento vira munição contra candidatura de Carlos Bolsonaro em SC | BASTIDORES CNN,Politica,17/06/2025
"Há indícios de que Carla Zambelli está nos arredores de Roma, diz embaixada | BASTIDORES CNN",Politica,17/06/2025
"Plano de golpe expôs papel clandestino da Abin, diz PF | BASTIDORES CNN",Politica,17/06/2025
Moraes rejeita suspender delação de Mauro Cid após autorizar acareação | BASTIDORES CNN,Politica,17/06/2025
Moraes autoriza acareação entre Mauro Cid e Braga Netto | BASTIDORES CNN,Politica,17/06/2025
Servidores da Abin pedem saída de diretor-geral indiciado pela PF,Politica,17/06/2025
Moraes nega pedido de Bolsonaro para anular delação de Mauro Cid,Politica,17/06/2025
Moraes autoriza acareação entre Torres e Freire Gomes,Politica,17/06/2025
Moraes autoriza acareação entre Cid e Braga Netto,Politica,17/06/2025
Oposição diz que derrubada de decreto do IOF será discutida com líderes,Politica,17/06/2025
Governo sanciona lei que criminaliza tatuagens e piercings em pets,Politica,17/06/2025
Advogado diz que mostrou perfil atribuído a Cid para defesa de Bolsonaro,Politica,17/06/2025
Dólar e Ibovespa recuam após dados dos EUA e com Oriente Médio em foco,Economia,17/06/2025
"44% dos pequenos negócios usam inteligência artificial, diz Sebrae",Economia,17/06/2025
"Hora da verdade para estancar gastos será após eleições, diz Kawall",Economia,17/06/2025
Concessões judiciais para BPC saltam 60% em três anos,Economia,17/06/2025
"Alta do aluguel desacelera a 0,59% em maio, diz pesquisa",Economia,17/06/2025
Membros do Fed se reúnem em meio a riscos geopolíticos e de tarifas,Economia,17/06/2025
Empresas tentam driblar tarifas dos EUA sobre produtos chineses; entenda,Economia,17/06/2025
CNU dos Professores: Inep publica edital com etapas e prazos; veja detalhes,Economia,17/06/2025
Focus: mercado mantém projeção de juros para 2025 na semana do Copom,Economia,17/06/2025
99Food relança serviço no Brasil com e foco em restaurantes e entregadores,Economia,17/06/2025
"Brasil avança em competitividade mas eficiência estatal trava, diz estudo",Economia,17/06/2025
Trump diz que União Europeia ainda não ofereceu acordo comercial justo,Economia,17/06/2025
"Mercado aumenta otimismo com América Latina, com foco em Brasil e México",Economia,17/06/2025
Totvs foca desenvolvimento de IA para pequenas e médias empresas,Economia,17/06/2025
Produção industrial da China desacelera em maio; varejo ganha força,Economia,17/06/2025
Trump e Starmer confirmam finalização de acordo comercial,Economia,17/06/2025
Operadores apostam que Fed irá manter taxa de juros até setembro,Economia,17/06/2025
"Eli Lilly comprará startup Verve por até US$ 1,3 bi",Economia,17/06/2025
"Candidatos a CEO da Renault podem ser Le Vot ou Picat, segundo analistas",Economia,17/06/2025
Ações europeias caem para menor nível em quase um mês com tensões globais,Economia,17/06/2025
Israel identifica novos lançamentos de mísseis do Irã e aciona sirenes | BASTIDORES CNN,Internacional,17/06/2025
Rússia chama G7 de “inútil” e diz que expulsão do G8 foi um erro  |  LIVE CNN,Internacional,17/06/2025
Conflito no Oriente Médio: Ataque cibernético atinge banco do Irã |  LIVE CNN,Internacional,17/06/2025
Israel diz que liderança militar do Irã está fugindo após ataques | LIVE CNN,Internacional,17/06/2025
Irã afirma ter atacado agência de espionagem de Israel | CNN NOVO DIA,Internacional,17/06/2025
Lula deve se encontrar com Zelensky no Canadá durante G7 | CNN NOVO DIA,Internacional,17/06/2025
Irã diz que ataques contra Israel se intensificarão nas próximas horas | CNN NOVO DIA,Internacional,17/06/2025
Israel x Irã: Trump afirma que algo “muito maior” está em andamento | CNN NOVO DIA,Internacional,17/06/2025
"Relembre trajetória de Greta Thunberg, ativista detida por Israel",Internacional,17/06/2025
"Quem é Miguel Uribe, pré-candidato à Presidência baleado na Colômbia",Internacional,17/06/2025
"Quem é Kirchner, ex-presidente da Argentina condenada à prisão",Internacional,17/06/2025
Como a briga de Trump com Musk afeta a política dos EUA?,Internacional,17/06/2025
Embate entre Trump e Musk põe fim a aliança central na política americana,Internacional,17/06/2025
"Saiba quem é Lee Jae-myung, novo presidente da Coreia do Sul",Internacional,17/06/2025
Quais brasileiros serão expulsos de Portugal? Entenda as regras,Internacional,17/06/2025
Proibição de estrangeiros em Harvard afeta Futura rainha da Bélgica,Internacional,17/06/2025
Câncer de Biden é anunciado em meio a debates sobre ex-presidente,Internacional,17/06/2025
"Preso por 14 anos, Mujica passou 10 deles em solitária; relembre",Internacional,17/06/2025
"Conclave é “muito diferente do filme”, diz dom Sérgio da Rocha à CNN",Internacional,17/06/2025
Banco iraniano é alvo de ataque cibernético de hackers ligados a Israel,Internacional,17/06/2025
"Israel x Irã: Trump diz que ""um fim real"" é melhor que um cessar-fogo",Internacional,17/06/2025
"""Líder supremo do Irã pode ter o destino de Saddam Hussein"", diz Israel",Internacional,17/06/2025
Irã ativa defesas aéreas no oeste do país após novos ataques de Israel,Internacional,17/06/2025
Irã diz que ataques contra Israel se intensificarão nas próximas horas,Internacional,17/06/2025
Trump diz que não entrou em contato com o Irã para negociações de paz,Internacional,17/06/2025
Desconforto nas pernas durante o sono pode ser síndrome neurológica,Saude,17/06/2025
Geração Z e Millennials lideram uso de remédios para saúde mental,Saude,17/06/2025
"Entenda o que é a “dose zero” contra o sarampo, anunciada para bebês",Saude,17/06/2025
"Hipertensão arterial pulmonar: entenda o que é, causas e sintomas",Saude,17/06/2025
Relações amorosas ajudam a proteger o cérebro e a saúde mental,Saude,17/06/2025
Por que sentimos mais fome no frio? Entenda,Saude,17/06/2025
Exames pré-natais podem identificar doença cardíaca e salvar vidas de bebês,Saude,17/06/2025
"57% dos brasileiros tem rotina diária de cuidados com a pele, diz estudo",Saude,17/06/2025
"Você dorme mal porque tem ciúme, ou tem ciúme porque dorme mal?",Saude,17/06/2025
Câncer de mama: uma em cada três pacientes tem menos de 50 anos,Saude,17/06/2025
Menopausa: entenda o que é e como o climatério afeta mulheres,Saude,17/06/2025
Pés ressecados? Saiba os melhores compostos para evitar rachaduras,Saude,17/06/2025
Câncer de mama: veja 3 boas notícias sobre avanços no tratamento,Saude,17/06/2025
Anvisa alerta para risco raro de perda de visão associado ao Ozempic,Saude,17/06/2025
Problemas de memória? Veja 5 dicas para se lembrar do que é importante,Saude,17/06/2025
Ganho de peso durante a vida pode acelerar envelhecimento do cérebro,Saude,17/06/2025
Desconforto nas pernas durante o sono pode ser síndrome neurológica; veja,Saude,17/06/2025
Junho Vermelho: veja as principais dúvidas sobre doação de sangue,Saude,17/06/2025
Nasa nega vínculo com jovem que alega ser primeira astronauta brasileira,Tecnologia,17/06/2025
Redução de aves dispersoras de sementes dificulta frear mudanças climáticas,Tecnologia,17/06/2025
Nova espécie de morcego é descoberta no Brasil; veja,Tecnologia,17/06/2025
Estudo: Mulheres emitem 26% menos gases de efeito estufa que homens,Tecnologia,17/06/2025
Pangeia Próxima: é possível que continentes atuais voltem a se unir?,Tecnologia,17/06/2025
Calçada dos Gigantes: conheça enigma geológico da costa irlandesa,Tecnologia,17/06/2025
Exoplaneta intrigante próximo da Terra pode ter água líquida,Tecnologia,17/06/2025
WhatsApp: saiba como proteger seu app do roubo de dados,Tecnologia,17/06/2025
Ouro e metais preciosos do núcleo da Terra vazam até superfície,Tecnologia,17/06/2025
Aspergillus flavus: conheça os fungos que inspiraram &#8220;The Last of Us&#8221;,Tecnologia,17/06/2025
Internet 6G: o que se sabe até agora e quando deve operar,Tecnologia,17/06/2025
Como fazer símbolos e caracteres especiais que não estão no teclado,Tecnologia,17/06/2025
"""Filhotes"" mumificados de 14 mil anos não eram cães, mostra nova pesquisa",Tecnologia,17/06/2025
Esqueletos de 6 mil anos com linhagem humana inédita são descobertos,Tecnologia,17/06/2025
"Após polêmica, jovem que se diz astronauta cita descoberta de asteroide",Tecnologia,17/06/2025
Caso de assassinato de 688 anos revela gangue da Inglaterra medieval; veja,Tecnologia,17/06/2025
"Conheça Jawlene, jacaré resgatado sem parte do maxilar que viralizou na web",Tecnologia,17/06/2025
Meta processa criador de app que gera nudes falsos com IA,Tecnologia,17/06/2025
Animais que brilham no escuro revelam pistas sobre regeneração de membros,Tecnologia,17/06/2025
Astro do Chelsea aprova entrada “à la NBA” da Copa do Mundo de Clubes,Esportes,17/06/2025
Quais grupos vão se enfrentar no mata-mata? Veja o chaveamento do Mundial,Esportes,17/06/2025
Monterrey x Inter de Milão: onde assistir à Copa do Mundo de Clubes,Esportes,17/06/2025
Presidente da CBF comenta chances de clubes brasileiros vencerem o Mundial,Esportes,17/06/2025
Ultras do Al Ahly roubam bandeirão da torcida do Palmeiras no Mundial,Esportes,17/06/2025
Corinthians vive incerteza sobre futuro de Rodrigo Garro; entenda cenário,Esportes,17/06/2025
"Destaque do Borussia espera controle sobre o Fluminense: ""Ser chefe""",Esportes,17/06/2025
River Plate x Urawa Red Diamonds: veja escalações do jogo pelo Mundial,Esportes,17/06/2025
"Fluminense domina o Dortmund, mas empata na Copa do Mundo de Clubes",Esportes,17/06/2025
Veja três motivos para acompanhar Ulsan HD x Mamelodi Sundowns,Esportes,17/06/2025
Calor extremo no Mundial de Clubes acende alerta sobre riscos à saúde,Esportes,17/06/2025
Mundial de Clubes: Fluminense tem histórico positivo contra europeus; veja,Esportes,17/06/2025
João Fonseca perde de virada para Cobolli na estreia do ATP 500 de Halle,Esportes,17/06/2025
"Patrocinado pela Virginia, fisiculturista vai buscar vaga no Mr. Olympia",Esportes,17/06/2025
"Astro do Tottenham, Son é anunciado como novo personagem de Fortnite",Esportes,17/06/2025
Esports: atleta brasileiro cita bomba atômica e perde patrocínio japonês,Esportes,17/06/2025
"Sucessor de Pes e Fifa? Conheça o Rematch, novo game de futebol",Esportes,17/06/2025
Por que o xadrez está construindo uma parceria improvável com eSports,Esportes,17/06/2025
"Jornalista ""sente inveja"" de Palmeiras no Mundial de Clubes | DOMINGOL",Esportes,17/06/2025
"Palmeiras nunca será campeão mundial, afirma Dinei | DOMINGOL",Esportes,17/06/2025
Contrato de Memphis Depay é revelado no Domingol | DOMINGOL,Esportes,17/06/2025
"Neymar não demonstra interesse na carreira dele, afirma Mano | DOMINGOL",Esportes,17/06/2025
"Yuri Alberto deve receber proposta milionária da Inter de Milão, diz Benja | DOMINGOL",Esportes,17/06/2025
Sheik: Augusto Melo Já cansou de mentir e gastou R$ 130 mi sem Corinthians ter dinheiro | DOMINGOL,Esportes,17/06/2025
Duilio responde críticas no Domingol | DOMINGOL,Esportes,17/06/2025
"Benja para Duilio: ""Você é o maior cara de pau que conheci na vida"" | DOMINGOL",Esportes,17/06/2025
"Sheik: Corinthians me deveu até cinco meses, mas eu tinha certeza que receberia | DOMINGOL",Esportes,17/06/2025
Zico: Dorival deveria ter levado Pedro em sua primeira convocação | DOMINGOL,Esportes,17/06/2025
"Zico: Não gosto de comparações, só procurei fazer o meu melhor | DOMINGOL",Esportes,17/06/2025
"AO VIVO: Entrevista com Rodolfo Landim, ex-presidente do Flamengo | CNN ESPORTES S/A",Esportes,17/06/2025
Ex-presidente diz que Flamengo seria o clube mais valioso do Brasil se virasse SAF |CNN ESPORTES S/A,Esportes,17/06/2025
"AO VIVO: Entrevista com Samir Xaud, candidato à Presidência da CBF | CNN ESPORTES S/A",Esportes,17/06/2025
Samir Xaud diz que instabilidade na CBF já é página virada | CNN ESPORTES S/A,Esportes,17/06/2025
Samir Xaud diz que portas da CBF estão abertas para Ronaldo | CNN ESPORTES S/A,Esportes,17/06/2025
"AO VIVO: Entrevista com Alex, ídolo do Cruzeiro, Palmeiras e Fenerbahce | CNN ESPORTES S/A",Esportes,17/06/2025
"Alex, ex-seleção, defende presença de técnicos estrangeiros no Brasil: “Enriquece” |CNN ESPORTES S/A",Esportes,17/06/2025
Alex relembra criação do Bom Senso FC e diz que futebol está longe do ideal | CNN ESPORTES S/A,Esportes,17/06/2025
"AO VIVO: Entrevista com Gilberto Silva, pentacampeão com a Seleção Brasileira | CNN ESPORTES S/A",Esportes,17/06/2025
Gilberto Silva se emociona ao relembrar início da carreira | CNN ESPORTES S/A,Esportes,17/06/2025
Ex-Seleção cobra união no futebol brasileiro: “Tudo isso é frustrante” | CNN ESPORTES S/A,Esportes,17/06/2025
"Entrevista com Rubens Menin, investidor da SAF do Atlético Mineiro | CNN ESPORTES S/A",Esportes,17/06/2025
