Título,Seção,Data
Rubens Menin celebra sucesso da Arena MRV: “Só dá retorno ao Atlético-MG” | CNN ESPORTES S/A,Esportes,17/06/2025
"Atlético-MG recebeu investimento acima de R$ 1 bilhão na SAF, diz Menin | CNN ESPORTES S/A",Esportes,17/06/2025
"AO VIVO: Entrevista com João Paulo, presidente do Botafogo | CNN ESPORTES S/A - 27/04/2025",Esportes,17/06/2025
"Presidente do Botafogo aposta no Mundial e critica “síndrome de vira-lata"" | CNN ESPORTES S/A",Esportes,17/06/2025
Presidente do Botafogo exalta parceria com John Textor | CNN ESPORTES S/A,Esportes,17/06/2025
Soldado: “A verdade é que as dívidas do Corinthians são enormes” | CNN ESPORTES S/A,Esportes,17/06/2025
"Chegada de Depay ao Corinthians atrai outros jogadores, revela dirigente | CNN ESPORTES S/A",Esportes,17/06/2025
"AO VIVO: Entrevista com Hortência, rainha do basquete brasileiro | CNN ESPORTES S/A - 13/04/2025",Esportes,17/06/2025
"Hortência não acredita em vaga no basquete em LA 28: “No feminino, esquece” | CNN ESPORTES S/A",Esportes,17/06/2025
Hortência critica alienação de atletas e cita Neymar | CNN ESPORTES S/A,Esportes,17/06/2025
"AO VIVO: Entrevista com Pedro Martins, CEO do Santos | CNN ESPORTES S/A - 06/04/2025",Esportes,17/06/2025
"Santos aposta em “temporada sólida” de Neymar, afirma CEO | ESPORTES S/A",Esportes,17/06/2025
"“Hoje o Santos perde dinheiro quando joga na Vila”, afirma CEO do clube | ESPORTES S/A",Esportes,17/06/2025
"AO VIVO: Entrevista com Bruno Rodrigues, presidente do Santa Cruz | CNN ESPORTES S/A - 30/03/2025",Esportes,17/06/2025
Presidente: Santa Cruz pretende ter a maior folha da Série D | ESPORTES S/A,Esportes,17/06/2025
"Presidente do Santa Cruz sobre SAF no clube: ""Não vejo outra solução"" | ESPORTES S/A",Esportes,17/06/2025
"AO VIVO: Entrevista com Vanderlei Luxemburgo, treinador | CNN ESPORTES S/A - 23/03/2025",Esportes,17/06/2025
Luxemburgo vai voltar para o futebol? Treinador responde | ESPORTES S/A,Esportes,17/06/2025
Luxemburgo vê etarismo no futebol brasileiro: “Somos execrados” | ESPORTES S/A,Esportes,17/06/2025
"Entrevista com Lisandro Lopez, Stefan Madach e Rodolfo Morais da XP | CNN ESPORTES S/A - 16/03/2025",Esportes,17/06/2025
XP vê Brasileirão com potencial de Premier League | ESPORTES S/A,Esportes,17/06/2025
"AO VIVO: Entrevista com Alex Bougeois, CEO da Portuguesa | CNN ESPORTES S/A - 02/03/2025",Esportes,17/06/2025
Saiba o que a SAF da Portuguesa planeja para o Canindé | CNN ESPORTES S/A,Esportes,17/06/2025
Base é prioridade para SAF da Portuguesa: “Resgatar o futebol brasileiro” | CNN ESPORTES S/A,Esportes,17/06/2025
Bolada? Veja quanto o Fluminense pode faturar com vitória no Mundial,Esportes,17/06/2025
Saiba por que Endrick não disputa o Mundial com o Real Madrid,Esportes,17/06/2025
Neymar Pai admite que queria que filho disputasse o Mundial de Clubes,Esportes,17/06/2025
Botafogo: Luiz Henrique diz que Textor o convenceu a recusar Flamengo,Esportes,17/06/2025
"Saiba quem é o português Admar Lopes, novo diretor executivo do Vasco",Esportes,17/06/2025
"Apresentado pelo Galatasaray, Sané jogará Mundial pelo Bayern; entenda",Esportes,17/06/2025
Fifa elege o Flamengo como &#8220;time mais brasileiro&#8221; do Mundial; entenda,Esportes,17/06/2025
"Quem é Kauê Furquim, joia de 16 anos do Corinthians",Esportes,17/06/2025
Veja os brasileiros fora do país que estão no Mundial de Clubes,Esportes,17/06/2025
Mundial de Clubes tem premiação bilionária; veja valores detalhados,Esportes,17/06/2025
Mundial de Clubes: veja o Top 10 dos jogadores mais valiosos,Esportes,17/06/2025
"Felipe Neto ironiza o Dortmund: ""Maneiro esse Fluminense x Volta Redonda""",Esportes,17/06/2025
Daniel Alves recupera valor milionário após vitória sobre ex na Justiça,Esportes,17/06/2025
Fluminense e Dortmund estão escalados para jogo da Copa do Mundo de Clubes,Esportes,17/06/2025
"Campeão mundial detona: ""Quando Vini Jr. começa a falar de outras coisas...""",Esportes,17/06/2025
VNL: José Roberto define 14 jogadoras para segunda semana da competição,Esportes,17/06/2025
Coincidência? Di María volta a marcar contra argentinos após exatos 18 anos,Esportes,17/06/2025
Presidente do São Paulo manda recado e abre portas para retorno de Zubeldía,Esportes,17/06/2025
Morata revela luta contra depressão e questiona futuro com a Espanha,Esportes,17/06/2025
"Chefe de LaLiga dispara contra o Mundial de Clubes e quer ""eliminá-lo""",Esportes,17/06/2025
