Título,Seção,Data
Folha de São Paulo - marca do jornal na navegação principal,Principal,17/06/2025
United States of America flagEnglish edition,Principal,17/06/2025
"Link externo, abre página da Folha de S.Paulo no X",Principal,17/06/2025
"Link externo, abre página da Folha de S.Paulo no Linkedin",Principal,17/06/2025
"Link externo, abre página da Folha de S.Paulo no Instagram",Principal,17/06/2025
"Link externo, abre página RSS da Folha de S.Paulo",Principal,17/06/2025
Valores progressistas não são únicos em sociedade pluralista,Principal,17/06/2025
Lula quer utilizar o Supremo para amenizar fraude no INSS,Principal,17/06/2025
Piadas matam! Make George Orwell fiction again! Feliz 1984!,Principal,17/06/2025
Silêncio pode ser melhor reação contra os vampiros emocionais,Principal,17/06/2025
Condenações de racistas trazem um pouco da nossa fé de volta,Principal,17/06/2025
"Trump exige rendição do Irã e afirma que 'não vai matar líder supremo do país, por enquanto'Presidente afirma que Khamenei é 'alvo fácil' e fala como se fossem os EUA, não Israel, que estão em guerra no Oriente Médio",Principal,17/06/2025
"Israel faz serviço sujo por nós no Irã, afirma primeiro-ministro da Alemanha",Principal,17/06/2025
"Tel Aviv promove guerra secreta com drones, mísseis e hackers contra o país persa",Principal,17/06/2025
Israel destrói antigos caças F-14 do Irã; assista,Principal,17/06/2025
"PF indicia Jair Bolsonaro, Carlos e Ramagem devido ao caso da 'Abin Paralela'",Principal,17/06/2025
Servidores da Abin cobram demissão de diretor-geral após indiciamento,Principal,17/06/2025
Evento de Tarcísio no interior de SP vira ato de desagravo ao ex-presidente,Principal,17/06/2025
O que pesa contra ex-presidente além de trama golpista e episódio da Abin,Principal,17/06/2025
Moraes aprova acareação entre Braga Netto e Cid na terça (24),Principal,17/06/2025
Advogado diz ter falado com Cid sobre delação e manda diálogos ao Supremo,Principal,17/06/2025
Órgão do Cade aprova a compra de parte do Master pelo BRB,Principal,17/06/2025
"copa do mundo de clubesJhon Arias criou principais chances de gol para o Fluminense; clube carioca para no goleiro do Borussia, e brasileiros fecham primeira rodada invictos -David Ramos/Getty Images via AFP",Principal,17/06/2025
"Lula no CanadáPresidente é recebido por indígenas canadenses ao chegar para encontro do G7; sem ver Trump, que foi embora, brasileiro diz que conflito entre Israel e Irã preocupa -Todd Korol/Reuters",Principal,17/06/2025
"lembrança do craquePortuguês António Costa, presidente do Conselho Europeu, entrega camisa de Cristiano Ronaldo para Trump durante o G7, no Canadá; veja imagens de hoje -António Costa no X",Principal,17/06/2025
"🙄Giorgia Meloni revira os olhos enquanto conversa com Emmanuel Macron fora dos microfones durante reunião do grupo em Kananaskis, no Canadá; veja vídeo -TV Folha/Reprodução",Principal,17/06/2025
ceratossauro de 150 milhões de anosFóssil de dinossauro avaliado em até R$ 33 milhões será levado a leilão; paleontólogos temem que esse tipo de negócio gere especulação -Mattew Sherman/Sotheby's,Principal,17/06/2025
"Ônibus tombadoColetivo cai em canal na Barra da Tijuca, na zona oeste do Rio, e deixa 33 feridos; maioria das pessoas sofreu ferimentos leves, de acordo com Bombeiros -Reprodução/Prefeitura do RJ",Principal,17/06/2025
RS registra em 24 h quantidade de chuva esperada para o mês,Principal,17/06/2025
Inmet emite alerta vermelho para o estado até a próxima quinta-feira (19),Principal,17/06/2025
Qual a sua opinião sobre proibir redes sociais para jovens?,Principal,17/06/2025
"Aliados de Lula observam sinais dúbios de Motta e dizem que ele é tutelado por Lira, Ciro e CunhaGrande derrota no IOF aumenta as incertezas",Principal,17/06/2025
Entorno de Motta diz que ele nunca se comprometeu com medida de Haddad,Principal,17/06/2025
Presidente resiste a seguir orientações de comunicação de Sidônio Palmeira,Principal,17/06/2025
"Datafolha: 76% dos brasileiros são contra aumento no número de deputados federais no BrasilProjeto, já aprovado na Câmara,  amplia total de 513 para 531 e entra na pauta do Senado",Principal,17/06/2025
"Trabalho formal avançou mais entre pobres, e cifras contrariam afirmação do 'rei do ovo' à Folha",Principal,17/06/2025
Entidades sindicais criticam falas do empresário sobre o Bolsa Família,Principal,17/06/2025
"Empresário achado em buraco no autódromo de Interlagos foi morto por asfixia, aponta laudoMorte de Adalberto Junior é investigada como assassinato; exame não apontou uso de droga",Principal,17/06/2025
Governo concede em leilão 19 novas regiões para a exploração de petróleo na Foz do Amazonas,Principal,17/06/2025
Licitação das áreas é alvo de protestos no Rio de Janeiro e na Alemanha; veja,Principal,17/06/2025
"Sou escritora e feminista, mas não uma escritora feminista, diz Chimamanda Adichie no BrasilAutora defende a que literatura que parte da ideologia é algo 'mais grosseiro do que a arte'",Principal,17/06/2025
Clube Folha Gourmet: descontos que pagam o valor da sua assinatura!,Principal,17/06/2025
Livros de colorir são relaxantes? Sim. Mas há problemas também,Principal,17/06/2025
"Ainda que livros como 'Bobbie Goods' sejam capazes de oferecer satisfação, a comparação, a autocobrança e até mesmo o fato de fazer pelo modismo podem causar o efeito reverso",Principal,17/06/2025
"Bruno Gualano, docente da USP, revela em curso o que funciona para ganho de massa muscular",Principal,17/06/2025
Plataforma de streaming reúne aulas dadas por nomes de diferentes áreas,Principal,17/06/2025
Testes de habilidades específicas de artes nos vestibulares exigem preparo que escola não oferece,Principal,17/06/2025
Vai fazer essa prova? Entenda como funciona e veja dicas para se preparar,Principal,17/06/2025
"'Só descobri quem eu era aos 18 anos', diz Antonieta Felmanas, que sobreviveu ao Holocausto",Principal,17/06/2025
"Depardieu sexualiza menor de idade em vídeo, conclui perícia",Principal,17/06/2025
Avião faz pouso no telhado de hangar de aeroporto dos EUA,Principal,17/06/2025
CNN corta quatro programas e demite Basília Rodrigues,Principal,17/06/2025
"Anitta diz que tem infecção bacteriana, e tratamento é lento",Principal,17/06/2025
Nova York aceita cães como testemunha de casamentos oficiais,Principal,17/06/2025
"China causa um novo choque de exportações no mundo em meio à guerra comercial com os EUATarifas de Trump fecham mercado americano, e chineses inundam América Latina e Europa",Principal,17/06/2025
"Em crise financeira, os Correios vão receber R$ 4 milhões por atender a beneficiários do INSS",Principal,17/06/2025
Fila do INSS chega a quase 4 milhões em maio; saiba acelerar seu pedido,Principal,17/06/2025
"Congresso pode derrubar vetos de Lula e retomar os jabutis que devem elevar a conta de energiaPresidente barrou dispositivos no começo do ano, mas parlamentares têm a palavra final",Principal,17/06/2025
Dólar e Bolsa rondam a estabilidade na véspera de decisões de BC e Fed,Principal,17/06/2025
"Bancos centrais devem comprar mais ouro e menos dólar para reservas, diz pesquisa",Principal,17/06/2025
Concursos do Judiciário terão novas regras para pessoas com deficiência,Principal,17/06/2025
"Dona do Mounjaro compra empresa de genética por US$ 1,3 bilhão",Principal,17/06/2025
"Noruega lança projeto para captura de carbono e subsidia R$ 12,2 bilhões",Principal,17/06/2025
Tarcísio avança pela borda por 2026 e busca se equilibrar para não afastar apoio de BolsonaroAliados veem governador atrás da chancela do ex-presidente para a disputa ao Planalto,Principal,17/06/2025
'Elio' exibe como as animações originais estão perdendo espaço,Principal,17/06/2025
"CríticaLonge de ser memorável, filme que estreia na quinta sabe emocionar",Principal,17/06/2025
Masp vai ter entrada gratuita e horário ampliado na quinta (19),Principal,17/06/2025
"Na contramão do 'to go', firma aposta no apelo afetivo do café com biscoito e fatura R$ 100 mi",Principal,17/06/2025
Clique para ver todos os cartuns publicados na Folha,Principal,17/06/2025
Como identificar o que deve (ou não) ser falado no seu trabalho,Principal,17/06/2025
'Procurados: Osama Bin Laden'série na Netflix★★★,Principal,17/06/2025
'Grande Golpe do Leste'filme de Natja Brunckhorst★★★★,Principal,17/06/2025
'Guerreiros do Sol'novela do Globoplay★★★,Principal,17/06/2025
'O Rochedo de Tânios'romance de Amin Maalouf★★★★,Principal,17/06/2025
"Gold card de Trump, que custará R$ 5 milhões, já tem cerca de 70 mil inscritos, segundo o governoSecretário de Comércio afirma que visto 'será lindo' e vai ajudar a pagar dívidas americanas",Principal,17/06/2025
Aluno que integrava o programa de intercâmbio estadual do PR é encontrado morto no CanadáEstudante de 16 anos estava desaparecido há um dia; ele havia entrado em rio em Nackawic,Principal,17/06/2025
Policial penal é preso em Minas sob suspeita de atirar em carro e atingir uma menina de 10 anosDefesa afirma que agente se sentiu ameaçado e não teve intuito de disparar contra pessoas,Principal,17/06/2025
Jornalista detida por injúria volta a ofender homens gays um dia depois de ser solta da prisãoAdriana Ramos de Oliveira é levada outra vez à delegacia após episódio em um condomínio,Principal,17/06/2025
"Advogados são presos suspeitos de envolvimento na morte de 2 empresários em Piracicaba (SP)Eles representavam as vítimas e teriam se apropriado de R$ 12 mi de imóveis, diz polícia",Principal,17/06/2025
"Saiba como ossada de Mengele, descoberta há quatro décadas, virou material didático no BrasilNazista morreu no país em 1979; identidade verdadeira foi descoberta apenas em 1985",Principal,17/06/2025
"No caso do Censo, ninguém sabe o impacto real do cristianismo evangélico hoje. Há pouco dado e muito interesse em jogo. E assim será até que um lado prevaleçaJuliano Spyerleia o texto na íntegra",Principal,17/06/2025
"Espero que o dia da libertação esteja perto para as pessoas que vivem no Irã, cobaias desde 1979",Principal,17/06/2025
"Por que apenas construir novas moradias se podemos reformar as que já existem? Há muitas famílias com casa, mas que vivem em condições inadequadasPolíticas e Justiçaleia o texto na íntegra",Principal,17/06/2025
"Acompanhar a morte de meus pais foi uma experiência que jamais teria desejado viver, mas da qual não quero me desfazerJúlia Jalbut (São Paulo, SP)no blog Praça do Leitor",Principal,17/06/2025
"Em batalha de quase 3 h, João Fonseca cai na 1ª rodada em HalleBrasileiro ainda disputa a chave de duplas do torneio alemão ao lado do grego Petros Tsitsipas",Principal,17/06/2025
"Ouro olímpico em LA é principal motivação para seguir jogando, afirma Djokovic",Principal,17/06/2025
"Tailândia faz proposta de R$ 6,6 bi por corrida de F1 em 2028Sediar prova da categoria ajudará a promover turismo, um  motor da economia tailandesa",Principal,17/06/2025
"São PauloEmpresário encontrado em buraco no autódromo de Interlagos morreu por asfixia, aponta laudo",Principal,17/06/2025
Mônica BergamoCNN Brasil corta quatro programas e demite Basília Rodrigues,Principal,17/06/2025
LGBTQIA+Jornalista presa por ofensas homofóbicas no sábado volta a ofender homens gays em condomínio em SP,Principal,17/06/2025
Congresso NacionalHugo Motta cede à pressão de deputados e amplia conflito com governo Lula e STF após lua de mel,Principal,17/06/2025
LGBTQIA+Quem é a jornalista presa após chamar homem de bicha nojenta em SP,Principal,17/06/2025
"Xenofobia contra nordestinos, fé e feminismo pautam debates da Feira do Livro, em São Paulo",Principal,17/06/2025
Walter Salles pedirá ao governo Lula a criação de um museu no antigo prédio do Dops no Rio,Principal,17/06/2025
Planet Hemp anuncia turnê de despedida e o fim da banda após os últimos shows em novembro,Principal,17/06/2025
Cineasta brasileira encontra filmagens inéditas de Orson Welles em Ouro Preto: 'Valor incalculável',Principal,17/06/2025
"'O Último Azul', filme de Gabriel Mascaro que foi premiado em Berlim, abrirá o Festival de Gramado",Principal,17/06/2025
Alexandre Nero vaza cenas secretas com detalhes do casamento de Maria de Fátima; veja vídeo,Principal,17/06/2025
Natuza Nery é atingida na cabeça por peça de metal dentro dos estúdios Globo,Principal,17/06/2025
"Após levar picada de jararaca, Guilherme Fontes fala sobre recuperação: 'Estou bem'",Principal,17/06/2025
Record se inspira em êxito de Sheherazade e procura jornalista para elenco de A Fazenda 17,Principal,17/06/2025
"Rapper R. Kelly é hospitalizado depois de sofrer uma overdose, e advogado acusa penitenciária",Principal,17/06/2025
Marte em virgem traz impulsos controlados e maior praticidade,Principal,17/06/2025
SicrediEducação financeira desde a infância,Principal,17/06/2025
Prefeitura de SPMais de 1.200 títulos de posse de imóveis são entregues,Principal,17/06/2025
UnileverDatafolha: Brasileiro quer cheiro bom no corpo inteiro,Principal,17/06/2025
Minas GeraisDesenvolvimento ao Vale do Jequitinhonha,Principal,17/06/2025
Prefeitura de SPDiretores de escola são requalificados,Principal,17/06/2025
CadastraBuscas online: entenda o que é relevante,Principal,17/06/2025
Rede D'OrExcelência em qualidade redefine padrões na saúde,Principal,17/06/2025
Nove de JulhoHospital alcança marca de 10 mil cirurgias robóticas,Principal,17/06/2025
"Stella ArtoisAção eterniza momento ""pure gold"" de Guga",Principal,17/06/2025
InHausFarraial leva o universo premium à Festa do Peão de Americana,Principal,17/06/2025
PepsicoPlantar e proteger o planeta ao mesmo tempo,Principal,17/06/2025
Sesi-SPSérie Pra Falar de Educação estreia; ouça,Principal,17/06/2025
Sesi-SPMatemática é um dos temas centrais da educação,Principal,17/06/2025
Companhia das LetrasUma homenagem aos 25 melhores livros do século 21,Principal,17/06/2025
Pallas EditoraTrabalho reconhecido por ranking,Principal,17/06/2025
Estúdio FolhaProjeto para Netflix recebe menção honrosa em concurso,Principal,17/06/2025
RevoEmbaixadores da Revo redefinem o ato de voar,Principal,17/06/2025
HeinekenMestre cervejeiro revela segredos do sabor único,Principal,17/06/2025
"Recursos públicos no Brasil são, sim, suficientesAssim pensam 55% dos brasileiros, segundo o Datafolha; déficit é sinal de que gastos são incompatíveis com renda do país",Principal,17/06/2025
"Avanço da educação é lentoTaxas de analfabetismo e de matrículas em creches melhoram desde 2016, mas objetivos do Plano Nacional não são cumpridos",Principal,17/06/2025
"Distonia focal, saúde mental e a música nas escolas",Principal,17/06/2025
Leitores comentam conflito entre Israel e Irã,Principal,17/06/2025
18/6Cátedra Otavio Frias Filho vai discutir políticas de educação,Principal,17/06/2025
"26/6Comunidade Todas lê 'Se Deus Me Chamar Não Vou', de Mariana Carrara",Principal,17/06/2025
"Don L repensa as influências de seu rap para criar 'uma utopia na distopia'Rapper lança novo disco, continuação do álbum 'Caro Vapor', de doze anos atrás",Principal,17/06/2025
Drone explode prédio residencial de Kiev; veja fotos de hoje,Principal,17/06/2025
Veja imagens que marcaram a história do Maracanã,Principal,17/06/2025
"Bolsas, dólar e empresas: acompanhe o mercado financeiro",Principal,17/06/2025
O jornal Folha de S.Paulo (1921 - 2025) é publicado pela Empresa Folha da Manhã S.A. CNPJ: 60.579.703/0001-48,Principal,17/06/2025
